{
  "$schema": "https://nn.com/schemas/flow-dsl-v2.json",
  "id": "7006",
  "name": "Vida - Flujo Completo con Dossier",
  "version": "2.0.0",
  "productType": "vida",
  "metadata": {
    "description": "Flujo completo de cotizaci贸n de vida con integraci贸n dossier",
    "estimatedTime": "15-20 minutos",
    "requiresUnderwriting": true,
    "createdAt": "2025-10-03",
    "updatedAt": "2025-10-03"
  },
  "initialContext": {
    "dossierId": null,
    "productType": "vida",
    "currentStep": null,
    "completedSteps": [],
    "errors": []
  },
  "steps": [
    {
      "id": "quickquote",
      "title": "Calculadora",
      "type": "mfe",
      "viewId": "7006-quickquote",
      "remote": {
        "name": "mfe_quick_quote",
        "module": "./QuickQuoteView"
      },
      "navigation": {
        "next": "underwriting",
        "back": null
      },
      "guards": [
        {
          "id": "hasDossierId",
          "condition": {
            "!!": [{"var": "context.dossierId"}]
          },
          "errorPage": "/error/session-expired",
          "message": "Sesi贸n expirada"
        }
      ],
      "interstep": {
        "beforeNext": [
          {
            "id": "saveToDossier",
            "type": "http",
            "method": "PUT",
            "url": "/api/dossier/{{context.dossierId}}/steps/quickquote",
            "body": "{{session.quickquote}}",
            "timeout": 5000,
            "mapResult": {
              "results.quickquote.saveToDossier.status": "$.status",
              "results.quickquote.saveToDossier.timestamp": "$.timestamp"
            },
            "severity": "block",
            "onError": {
              "navigate": "/error/save-failed",
              "params": {
                "step": "quickquote",
                "errorCode": "{{error.code}}"
              }
            }
          },
          {
            "id": "notifyProgress",
            "type": "signalr",
            "event": "StepCompleted",
            "payload": {
              "dossierId": "{{context.dossierId}}",
              "step": "quickquote",
              "progress": 20
            }
          }
        ]
      }
    },
    {
      "id": "underwriting",
      "title": "Declaraci贸n de salud",
      "type": "mfe",
      "viewId": "7006-underwriting",
      "remote": {
        "name": "mfe_underwriting",
        "module": "./UnderwritingView"
      },
      "navigation": {
        "next": {
          "default": "personal-data",
          "conditions": [
            {
              "if": {
                ">": [{"var": "context.riskScore"}, 80]
              },
              "to": "error-step",
              "effects": [
                {
                  "assign": {
                    "session.errorReason": "high-risk",
                    "session.riskScore": "{{context.riskScore}}"
                  }
                }
              ]
            }
          ]
        },
        "back": "quickquote"
      },
      "guards": [
        {
          "id": "hasDossierId",
          "condition": {
            "!!": [{"var": "context.dossierId"}]
          },
          "errorPage": "/error/session-expired"
        }
      ],
      "interstep": {
        "beforeNext": [
          {
            "id": "saveToDossier",
            "type": "http",
            "method": "PUT",
            "url": "/api/dossier/{{context.dossierId}}/steps/underwriting",
            "body": "{{session.underwriting}}",
            "timeout": 5000,
            "mapResult": {
              "results.underwriting.saveToDossier.status": "$.status"
            },
            "severity": "block"
          },
          {
            "id": "calculateRisk",
            "type": "http",
            "method": "POST",
            "url": "/api/risk/calculate",
            "body": {
              "dossierId": "{{context.dossierId}}",
              "medicalHistory": "{{session.underwriting}}"
            },
            "timeout": 5000,
            "mapResult": {
              "context.riskScore": "$.riskScore",
              "results.underwriting.calculateRisk.score": "$.riskScore",
              "results.underwriting.calculateRisk.factors": "$.riskFactors"
            },
            "severity": "block"
          },
          {
            "id": "notifyProgress",
            "type": "signalr",
            "event": "StepCompleted",
            "payload": {
              "dossierId": "{{context.dossierId}}",
              "step": "underwriting",
              "progress": 40,
              "riskScore": "{{context.riskScore}}"
            }
          }
        ]
      }
    },
    {
      "id": "personal-data",
      "title": "Datos personales",
      "type": "mfe",
      "viewId": "7006-personal-data",
      "remote": {
        "name": "mfe_quotation",
        "module": "./PersonalDataView"
      },
      "navigation": {
        "next": "benefits",
        "back": "underwriting"
      },
      "guards": [
        {
          "id": "hasDossierId",
          "condition": {
            "!!": [{"var": "context.dossierId"}]
          },
          "errorPage": "/error/session-expired"
        },
        {
          "id": "isIdentityValid",
          "condition": {
            "and": [
              {"!!": [{"var": "session.personalData.curp"}]},
              {"!!": [{"var": "session.personalData.rfc"}]}
            ]
          },
          "errorPage": "/error/incomplete-data",
          "message": "Falta CURP o RFC"
        }
      ],
      "interstep": {
        "beforeNext": [
          {
            "id": "validateIdentity",
            "type": "http",
            "method": "POST",
            "url": "/api/identity/validate",
            "body": {
              "curp": "{{session.personalData.curp}}",
              "rfc": "{{session.personalData.rfc}}",
              "firstName": "{{session.personalData.firstName}}",
              "lastName": "{{session.personalData.lastName}}"
            },
            "timeout": 10000,
            "mapResult": {
              "context.identityValidated": "$.valid",
              "results.personalData.validateIdentity.status": "$.status",
              "results.personalData.validateIdentity.matchScore": "$.matchScore"
            },
            "severity": "fatal"
          },
          {
            "id": "saveToDossier",
            "type": "http",
            "method": "PUT",
            "url": "/api/dossier/{{context.dossierId}}/steps/personal-data",
            "body": "{{session.personalData}}",
            "timeout": 5000,
            "mapResult": {
              "results.personalData.saveToDossier.status": "$.status"
            },
            "severity": "block"
          },
          {
            "id": "createApplicant",
            "type": "http",
            "method": "POST",
            "url": "/api/applicants/create",
            "body": {
              "dossierId": "{{context.dossierId}}",
              "personalData": "{{session.personalData}}"
            },
            "timeout": 5000,
            "mapResult": {
              "context.applicantId": "$.applicantId",
              "results.personalData.createApplicant.id": "$.applicantId",
              "results.personalData.createApplicant.createdAt": "$.createdAt"
            },
            "severity": "fatal",
            "rollback": [
              {
                "type": "http",
                "method": "DELETE",
                "url": "/api/dossier/{{context.dossierId}}/steps/personal-data"
              }
            ]
          },
          {
            "id": "notifyProgress",
            "type": "signalr",
            "event": "StepCompleted",
            "payload": {
              "dossierId": "{{context.dossierId}}",
              "step": "personal-data",
              "progress": 60
            }
          }
        ]
      }
    },
    {
      "id": "benefits",
      "title": "Beneficiarios",
      "type": "mfe",
      "viewId": "7006-benefits",
      "remote": {
        "name": "mfe_quotation",
        "module": "./BenefitsView"
      },
      "navigation": {
        "next": "signature",
        "back": "personal-data"
      },
      "guards": [
        {
          "id": "hasDossierId",
          "condition": {
            "!!": [{"var": "context.dossierId"}]
          },
          "errorPage": "/error/session-expired"
        },
        {
          "id": "hasApplicantId",
          "condition": {
            "!!": [{"var": "context.applicantId"}]
          },
          "errorPage": "/error/applicant-not-found"
        },
        {
          "id": "isTotalPercentage100",
          "condition": {
            "===": [
              {
                "reduce": [
                  {"var": "session.benefits.beneficiaries"},
                  {"+": [{"var": "accumulator"}, {"var": "current.percentage"}]},
                  0
                ]
              },
              100
            ]
          },
          "errorPage": "/error/invalid-percentages",
          "message": "La suma de porcentajes debe ser 100%"
        }
      ],
      "interstep": {
        "beforeNext": [
          {
            "id": "validateBeneficiaries",
            "type": "http",
            "method": "POST",
            "url": "/api/beneficiaries/validate",
            "body": {
              "beneficiaries": "{{session.benefits.beneficiaries}}"
            },
            "timeout": 5000,
            "mapResult": {
              "results.benefits.validateBeneficiaries.valid": "$.valid",
              "results.benefits.validateBeneficiaries.warnings": "$.warnings"
            },
            "severity": "warn"
          },
          {
            "id": "saveToDossier",
            "type": "http",
            "method": "PUT",
            "url": "/api/dossier/{{context.dossierId}}/steps/benefits",
            "body": "{{session.benefits}}",
            "timeout": 5000,
            "mapResult": {
              "results.benefits.saveToDossier.status": "$.status"